{
  "receipt_id": "rcpt-936ddc17-32a3-40b8-96f7-3d6a8a366ad9",
  "event_id": "936ddc17-32a3-40b8-96f7-3d6a8a366ad9",
  "created_at": "2026-03-27T19:11:11.898401+00:00",
  "event_type": "prompt_submit",
  "org_id": "test-org",
  "user_id": "test-user",
  "event_hash": "2371af5a7c9880c134e9e08929a186f357ece160ecec183cee4c48d901148d86",
  "receipt_hash": "0cd134856ab0d334b675482266fe3d786a40fc3abd78e97dd9ec7ec883655d22",
  "tool_name": "ChatGPT",
  "policy_decision": "warn"
}