{
  "receipt_id": "rcpt-8420cbf3-aa44-4e12-a23a-f3663ff5d1d7",
  "event_id": "8420cbf3-aa44-4e12-a23a-f3663ff5d1d7",
  "created_at": "2026-03-27T23:23:02.369243+00:00",
  "event_type": "prompt_submit",
  "org_id": "test-org",
  "user_id": "test-user",
  "event_hash": "611b23f9fc6bdf76184a1f8a54fde6ef8adc03272bb173b1638399642b3854ec",
  "receipt_hash": "ebc8bae4948a09e35042a1332f6aca6f3569a7851a9cd4acad47e6b7788f19b9",
  "tool_name": "ChatGPT",
  "policy_decision": "warn"
}