{
  "receipt_id": "rcpt-367083d1-1362-46f0-8fc8-794aa542edb1",
  "event_id": "367083d1-1362-46f0-8fc8-794aa542edb1",
  "created_at": "2026-03-31T15:32:03.710767+00:00",
  "event_type": "prompt_submit",
  "org_id": "test-org",
  "user_id": "test-user",
  "event_hash": "3032774c26e8120f3ef5393516c8ee55b6da1768bbb37e8c73d541e67c3794fa",
  "receipt_hash": "e8405459659f7b71a36b4136e29f5991f6d0031ea0801eddbf65aa41e5ef7ae5",
  "tool_name": "ChatGPT",
  "policy_decision": "warn"
}