{
  "receipt_id": "rcpt-8b7ed6d0-6dd3-4564-b6e8-114177816eb4",
  "event_id": "8b7ed6d0-6dd3-4564-b6e8-114177816eb4",
  "created_at": "2026-03-31T16:18:46.911502+00:00",
  "event_type": "prompt_submit",
  "org_id": "test-org",
  "user_id": "test-user",
  "event_hash": "fa7245f21affebde71d194a5c5a18f7d814dbddc82aa200d86a2fb07e7bdb4a1",
  "receipt_hash": "2e7ffa1aabc15463ac4edc8a5bbe15e103ebc84834ef1911c0e2c20a94074eb5",
  "tool_name": "ChatGPT",
  "policy_decision": "warn"
}